{
  "$schema": "http://json-schema.org/draft-07/schema#",
  "$id": "https://terrain.dev/schemas/analysis/v1",
  "title": "Terrain Analysis Report",
  "description": "Output of `terrain analyze --json`. The canonical source of truth for the report shape is the Go type `analyze.Report` defined in `internal/analyze/analyze.go`; this schema is a permissive stub that pins only the schemaVersion contract. Adopters who want strict per-field validation should generate from the Go types directly. Field-level stability tiers are documented in `docs/schema/FIELD_TIERS.md`.",
  "type": "object",
  "required": ["schemaVersion"],
  "additionalProperties": true,
  "properties": {
    "schemaVersion": {
      "type": "string",
      "description": "Semantic version of the analyze report schema. Currently the string \"1\". Bumps follow `models.SnapshotSchemaVersion` in `internal/models/`.",
      "const": "1"
    },
    "repository": {
      "type": "object",
      "description": "Repository identification (name, branch, commit SHA, languages, frameworks, CI systems detected). See `analyze.RepositoryInfo` in `internal/analyze/analyze.go` for the full field list.",
      "additionalProperties": true
    },
    "dataCompleteness": {
      "type": "array",
      "description": "Inventory of which input data sources were available for this run (snapshot, coverage, runtime, baseline, etc.). Each entry is `{ name, available }`.",
      "items": { "type": "object", "additionalProperties": true }
    },
    "testsDetected": {
      "type": "object",
      "description": "Validation-asset summary: test file count, test case count, code unit count, scenario count, code surface count, framework breakdown.",
      "additionalProperties": true
    },
    "repoProfile": {
      "type": "object",
      "description": "Repository profile classification (test volume, CI pressure, coverage confidence, redundancy, fanout, skip burden, flake burden, manual coverage, graph density).",
      "additionalProperties": true
    },
    "coverageConfidence": {
      "type": "object",
      "description": "Structural coverage confidence summary (high/medium/low file counts).",
      "additionalProperties": true
    },
    "duplicateClusters": {
      "type": "object",
      "description": "Test redundancy clustering summary.",
      "additionalProperties": true
    },
    "highFanout": {
      "type": "object",
      "description": "High-fanout fixture/helper summary.",
      "additionalProperties": true
    },
    "skippedTestBurden": {
      "type": "object",
      "description": "Skipped-test-burden summary.",
      "additionalProperties": true
    },
    "weakCoverageAreas": {
      "type": "array",
      "description": "Source paths with poor structural coverage.",
      "items": { "type": "object", "additionalProperties": true }
    },
    "ciOptimization": {
      "type": "object",
      "description": "Estimated CI savings (duplicate-tests-removable, skipped-tests-reviewable, high-fanout-nodes, recommendation text).",
      "additionalProperties": true
    },
    "topInsight": {
      "type": "string",
      "description": "Single-sentence top opportunity. Superseded by keyFindings; retained for backward compat."
    },
    "keyFindings": {
      "type": "array",
      "description": "Top-3 prioritized findings shown inline in `analyze` output. Each entry: `{ title, severity, category, pillar?, metric? }`.",
      "items": { "type": "object", "additionalProperties": true }
    },
    "totalFindingCount": {
      "type": "integer",
      "description": "Total findings count (including those not shown in keyFindings)."
    },
    "riskPosture": {
      "type": "array",
      "description": "Risk-posture-by-dimension summary (matches `terrain posture --json`).",
      "items": { "type": "object", "additionalProperties": true }
    },
    "signalSummary": {
      "type": "object",
      "description": "Severity + category breakdowns of detected signals: `{ total, critical, high, medium, low, byCategory: {ai, health, migration, quality, structure, ...} }`. The supported severity-gate flag (`--fail-on=high|critical|medium`) is the canonical mechanism for gating CI on these counts.",
      "additionalProperties": true
    },
    "behaviorRedundancy": {
      "type": "object",
      "description": "Behavior-aware test redundancy clusters.",
      "additionalProperties": true
    },
    "stabilityClusters": {
      "type": "object",
      "description": "Unstable-test clustering by shared root cause.",
      "additionalProperties": true
    },
    "matrixCoverage": {
      "type": "object",
      "description": "Device/environment matrix analysis.",
      "additionalProperties": true
    },
    "manualCoverage": {
      "type": "object",
      "description": "Manual-validation overlay summary.",
      "additionalProperties": true
    },
    "edgeCases": {
      "type": "array",
      "description": "Structural anomalies that affect analysis confidence.",
      "items": { "type": "object", "additionalProperties": true }
    },
    "policy": {
      "type": "object",
      "description": "Derived policy from edge-case analysis.",
      "additionalProperties": true
    },
    "limitations": {
      "type": "array",
      "description": "Free-text notes about incompleteness in this run.",
      "items": { "type": "string" }
    },
    "discoveredArtifacts": {
      "type": "array",
      "description": "Auto-detected coverage and runtime artifacts.",
      "items": { "type": "object", "additionalProperties": true }
    },
    "headline": {
      "type": "string",
      "description": "Single-sentence opinionated summary of the test system state."
    },
    "nextActions": {
      "type": "array",
      "description": "Up to 3 prioritized next-step recommendations with runnable commands.",
      "items": { "type": "object", "additionalProperties": true }
    }
  }
}
