{
  "schemaVersion": "1",
  "repository": {
    "name": "sample-repo",
    "branch": "main",
    "commitSha": "25e98f9ebf",
    "languages": ["typescript"]
  },
  "dataCompleteness": [
    { "name": "source", "available": true },
    { "name": "coverage", "available": false },
    { "name": "runtime", "available": false },
    { "name": "policy", "available": false }
  ],
  "testsDetected": {
    "testFileCount": 18,
    "testCaseCount": 49,
    "codeUnitCount": 27,
    "codeSurfaceCount": 29,
    "frameworks": [
      { "name": "vitest", "fileCount": 18, "type": "unit" }
    ]
  },
  "skippedTestBurden": {
    "skippedCount": 3,
    "totalTests": 49,
    "skipRatio": 0.061224489795918366
  },
  "keyFindings": [
    {
      "title": "13 source files (100%) have low structural coverage — blind spots for test selection",
      "severity": "critical",
      "category": "coverage_debt",
      "metric": "13 files"
    },
    {
      "title": "3 skipped tests (6%) — consuming CI resources without providing value",
      "severity": "medium",
      "category": "reliability",
      "metric": "3 skipped"
    },
    {
      "title": "5 high-fanout fixture(s) — changes trigger wide test impact",
      "severity": "medium",
      "category": "architecture_debt",
      "metric": "5 flagged"
    }
  ],
  "totalFindingCount": 3,
  "riskPosture": [
    { "dimension": "health", "band": "moderate" },
    { "dimension": "coverage_depth", "band": "critical" },
    { "dimension": "coverage_diversity", "band": "strong" },
    { "dimension": "structural_risk", "band": "strong" },
    { "dimension": "operational_risk", "band": "strong" }
  ],
  "signalSummary": {
    "total": 20,
    "critical": 0,
    "high": 0,
    "medium": 20,
    "low": 0,
    "byCategory": {
      "quality": 20
    }
  },
  "headline": "13 source files (100%) have low structural coverage",
  "limitations": [
    "No coverage data provided; coverage confidence is structural (import-based) only.",
    "No policy file found; governance checks skipped.",
    "No runtime data provided; static skip detection is available, but flaky/slow/dead/unstable signals require runtime artifacts."
  ]
}
